{
  "pilot": "SCOPE-PILOT-003",
  "codebook_sha256": "3c9261450ffe3553a984788e5f764cc4f829624155b53b5272ae4ebc3f7f8e01",
  "order_sha256": "2e3d00332101e7ce90e4d186584b4b5cb09906f6bf337d869091dd6600f12bfb",
  "entries": [
    {
      "position": 1,
      "url": "https://github.com/vitest-dev/vitest/issues/2678",
      "repository": "vitest-dev/vitest",
      "repository_id": 434708679,
      "stratum": "tests",
      "screened_at": "2026-08-26T13:57:33.212439+00:00",
      "evidence_retrieved_at": "2026-08-26T13:55:23.580268+00:00",
      "evidence_sha256": {
        "issue": "e7d87f56f589330c8cf9ff6d6ea0001f95b3ab804fef9fd76f5bd34876350c0a",
        "comments": "10fb306466c6fa0f145c7d43b5d831a176acc0df47c55b3770b856aa148427e0"
      },
      "decision": "REJECT",
      "reason_code": "NO_AUTOMATED_CONTROL",
      "reason": "Package installation failure: the esbuild postinstall script rejected a version mismatch and the install exited 1. No automated verification control and no governing success signal are at issue, and nothing was falsely accepted.",
      "evidence_urls": [
        "https://github.com/vitest-dev/vitest/issues/2678"
      ]
    },
    {
      "position": 2,
      "url": "https://github.com/jestjs/jest/issues/11041",
      "repository": "jestjs/jest",
      "repository_id": 15062869,
      "stratum": "tests",
      "screened_at": "2026-08-26T13:57:33.212439+00:00",
      "evidence_retrieved_at": "2026-08-26T13:55:24.525824+00:00",
      "evidence_sha256": {
        "issue": "be7a35b4f82a0eb188efc4ca8f43dfd64b26d9b34a4b64d01583a135d8d6431d",
        "comments": "50eeb1004d0eb0586559370351e3b365e6f50a03da4ff6082167334a91ecb91d"
      },
      "decision": "REJECT",
      "reason_code": "OUT_OF_SCOPE_GATE_REJECTED",
      "reason": "A testMatch glob change caused Jest to discover no test files, but the named governing gate rejected: 'No tests found, exiting with code 1'. Codebook v1 places a check that failed closed OUT_OF_SCOPE even though the selector behavior is the mechanism of interest.",
      "evidence_urls": [
        "https://github.com/jestjs/jest/issues/11041"
      ]
    },
    {
      "position": 3,
      "url": "https://github.com/NixOS/nixpkgs/issues/82428",
      "repository": "NixOS/nixpkgs",
      "repository_id": 4542716,
      "stratum": "proofs_build_completeness",
      "screened_at": "2026-08-26T13:57:33.212439+00:00",
      "evidence_retrieved_at": "2026-08-26T13:55:25.574167+00:00",
      "evidence_sha256": {
        "issue": "c628c016c0e7f9f083f25d3f30afb702608184189ef977c754f61fed622c5409",
        "comments": "bcd9d6d995354dc494415febcd1e23a7edb2124e644f194ded39e77842111f6b"
      },
      "decision": "REJECT",
      "reason_code": "PRODUCT_DEFECT_NOT_CONTROL",
      "reason": "A NixOS module built with withoutClient cannot run mysql initialization. Maintainers adjudicated it as intended behavior of the module under test. The nixos test invoked reports the failure; the incident concerns the packaged product, not a verification control that accepted.",
      "evidence_urls": [
        "https://github.com/NixOS/nixpkgs/issues/82428"
      ]
    },
    {
      "position": 4,
      "url": "https://github.com/NixOS/nixpkgs/issues/87533",
      "repository": "NixOS/nixpkgs",
      "repository_id": 4542716,
      "stratum": "proofs_build_completeness",
      "screened_at": "2026-08-26T13:57:33.212439+00:00",
      "evidence_retrieved_at": "2026-08-26T13:55:26.625129+00:00",
      "evidence_sha256": {
        "issue": "ea9597e6576e9dd20accb751340827d8712e7f12b45aa7b264b6848ebf1fa28c",
        "comments": "4f53cda18c2baa0c0354bb5f9a3ecbe5ed12ab4d8e11ba873c2f11161202b945"
      },
      "decision": "REJECT",
      "reason_code": "NO_AUTOMATED_CONTROL",
      "reason": "Flatpak application cannot reach org.freedesktop.secrets. A desktop runtime defect with no automated verification control, no governing success signal, and no maintainer adjudication in the record.",
      "evidence_urls": [
        "https://github.com/NixOS/nixpkgs/issues/87533"
      ]
    },
    {
      "position": 5,
      "url": "https://github.com/rocq-prover/rocq/issues/16643",
      "repository": "rocq-prover/rocq",
      "repository_id": 1377159,
      "stratum": "proofs_build_completeness",
      "screened_at": "2026-08-26T13:57:33.212439+00:00",
      "evidence_retrieved_at": "2026-08-26T13:55:27.557555+00:00",
      "evidence_sha256": {
        "issue": "8eebe7646f2f95f309542ffc4e655bfaef6f24134105f8be2dc9d29f67ef83e4",
        "comments": "af81d51a15f2660b01269ff45dcfdf8d046ba1ce393ea8d9cc0fcf3ca4703f3e"
      },
      "decision": "REJECT",
      "reason_code": "PRODUCT_DEFECT_NOT_CONTROL",
      "reason": "coqide 8.16.0 fails to link on macOS arm64; the build reported exit code 1 and the issue was closed for lack of response after a year. The control reported the defect correctly; nothing was accepted.",
      "evidence_urls": [
        "https://github.com/rocq-prover/rocq/issues/16643"
      ]
    },
    {
      "position": 6,
      "url": "https://github.com/astral-sh/ruff/issues/1301",
      "repository": "astral-sh/ruff",
      "repository_id": 523043277,
      "stratum": "lint_static_analysis",
      "screened_at": "2026-08-26T13:57:33.212439+00:00",
      "evidence_retrieved_at": "2026-08-26T13:55:28.768115+00:00",
      "evidence_sha256": {
        "issue": "02d687276d905c126146ea2677d1a269e5c824f51ed2bac29663016aa84b0520",
        "comments": "31dde55080dc13dd78613e123da3e6ac76280fc002ba4a8001e12726729b392f"
      },
      "decision": "REJECT",
      "reason_code": "NO_PRIMARY_EVIDENCE",
      "reason": "Ruff checks config-excluded files when they are passed explicitly on the command line. The maintainer adjudicated this as intended and pointed to --force-exclude. The behavior is over-inclusion of scope, not acceptance, omission, or false success, so admission gate 2 is unmet.",
      "evidence_urls": [
        "https://github.com/astral-sh/ruff/issues/1301"
      ]
    },
    {
      "position": 7,
      "url": "https://github.com/NixOS/nixpkgs/issues/81933",
      "repository": "NixOS/nixpkgs",
      "repository_id": 4542716,
      "stratum": "proofs_build_completeness",
      "screened_at": "2026-08-26T13:57:33.212439+00:00",
      "evidence_retrieved_at": "2026-08-26T13:55:29.815521+00:00",
      "evidence_sha256": {
        "issue": "6828a75274ed8fb23fee65ce2cbf1043d1d8ac4b79ea8b8e37c2a42b58729069",
        "comments": "20d7c37bc8d513fb8f3326ecf601b4dde972b159ce83b151e2a4fbf3ba23dd6b"
      },
      "decision": "REJECT",
      "reason_code": "PRODUCT_DEFECT_NOT_CONTROL",
      "reason": "An nvidiaLegacy390 store-path collision aborted a NixOS system build. The reporter traced it to their own bumblebee configuration and closed the issue. The build failed closed on a configuration defect.",
      "evidence_urls": [
        "https://github.com/NixOS/nixpkgs/issues/81933"
      ]
    },
    {
      "position": 8,
      "url": "https://github.com/jestjs/jest/issues/10895",
      "repository": "jestjs/jest",
      "repository_id": 15062869,
      "stratum": "tests",
      "screened_at": "2026-08-26T13:57:33.212439+00:00",
      "evidence_retrieved_at": "2026-08-26T13:55:30.813304+00:00",
      "evidence_sha256": {
        "issue": "dd913774a979c43daad70dffb2f784a4946ba0e1f505f27126ca7addbb2103e2",
        "comments": "8af6ac064365e9f0b3ed3765ead0ca8579630b174cbdee9e6e8c73ffc565c9fe"
      },
      "decision": "REJECT",
      "reason_code": "NO_AUTOMATED_CONTROL",
      "reason": "Feature proposal for deadline-aware timeout errors in Jest, closed as stale and not planned. No incident, no observed control outcome, no governing signal.",
      "evidence_urls": [
        "https://github.com/jestjs/jest/issues/10895"
      ]
    },
    {
      "position": 9,
      "url": "https://github.com/koalaman/shellcheck/issues/2213",
      "repository": "koalaman/shellcheck",
      "repository_id": 6731432,
      "stratum": "lint_static_analysis",
      "screened_at": "2026-08-26T13:57:33.212439+00:00",
      "evidence_retrieved_at": "2026-08-26T13:55:31.941336+00:00",
      "evidence_sha256": {
        "issue": "870409bbecdba06c53e4146c4e54157446916cfb5209527d7f9efd67d790f6df",
        "comments": "77f7a09acead8d4aa171c062e546f7de99c63dac60c66b00be192c2800f0b84f"
      },
      "decision": "REJECT",
      "reason_code": "CONTRACT_DISPUTED",
      "reason": "Proposal that ShellCheck warn about a comma in printf arguments. ShellCheck's silence is a reproducible acceptance, but the claimed contract rests on reporter expectation alone and the owner adjudicated against adding the rule after measuring false positives. Retained in the calibration log as a T4-only contract.",
      "evidence_urls": [
        "https://github.com/koalaman/shellcheck/issues/2213"
      ]
    },
    {
      "position": 10,
      "url": "https://github.com/jestjs/jest/issues/11373",
      "repository": "jestjs/jest",
      "repository_id": 15062869,
      "stratum": "tests",
      "screened_at": "2026-08-26T13:57:33.212439+00:00",
      "evidence_retrieved_at": "2026-08-26T13:55:32.803110+00:00",
      "evidence_sha256": {
        "issue": "90537942925f34ffde30330b3eea8cbfe0c981dc9a0b6e83c6ccc968179160c7",
        "comments": "c53d5bee105ef4d1163fd4731aaf383fe5fa56a39144e237f2202daa46e356d5"
      },
      "decision": "REJECT",
      "reason_code": "OUT_OF_SCOPE_GATE_REJECTED",
      "reason": "Jest cannot resolve a pure-ESM dependency exposing only 'exports'. The suite reported 'Test suite failed to run' and the maintainer referenced the tracked exports-support gap. The check failed closed.",
      "evidence_urls": [
        "https://github.com/jestjs/jest/issues/11373"
      ]
    },
    {
      "position": 11,
      "url": "https://github.com/microsoft/playwright/issues/10500",
      "repository": "microsoft/playwright",
      "repository_id": 221981891,
      "stratum": "tests",